Headline,link
"New data suggests staying home, social distancing is saving lives",https://www.khou.com/article/news/health/coronavirus/new-data-suggests-staying-home-social-distancing-is-saving-lives/285-880fefea-a7ed-4aad-9d8b-13e8930eeb73
"Schumer proposes $25,000 'heroes' pay for frontline workers",https://www.khou.com/article/news/health/coronavirus/schumer-proposes-25000-heroes-pay-for-frontline-workers/285-477230fc-0864-4b9f-937b-038eff6e3412
"Update: Fourth person dies from COVID-19 in Brazos County, 68 confirmed cases",https://www.khou.com/article/news/brazos-county-reports-cases-of-coronavirus/285-bb82428a-417e-4287-b7f8-ef6cf60ffa2b
Coronavirus updates: Experts estimate more than 4K lives have been saved due to Harris County stay-home order,https://www.khou.com/article/news/health/coronavirus/coronavirus-updates-houston-live-blog-april-6/285-3fca5511-726f-4157-b3cf-da3a3ee0cfca
Woman who spent days on a ventilator after COVID-19 diagnosis returns home,https://www.khou.com/article/news/health/coronavirus/coronavirus-recovery-st-louis-county-woman-returns-home/285-377860dc-38a1-4384-a2b1-03ec60b14284
Wisconsin voters head to polls Tuesday despite stay-at-home order,https://www.khou.com/article/news/health/coronavirus/wisconsin-democratic-primary/285-6d08e23e-d868-4b93-9013-c32859821749
AP sources: MLB considering playing all games in empty Arizona ballparks,https://www.khou.com/article/sports/mlbphoenix/285-b7911231-572d-46bc-824c-9347dc33e4fe
