Headline,link
"Coronavirus updates: Houston cases include 8 firefighters, 12 police officers, 18 city workers",https://www.khou.com/article/news/health/coronavirus/coronavirus-updates-houston-live-log-april-1/285-c888c9ae-882e-4d86-9ab3-69cf4e4079f8
'Reading Rainbow' host LeVar Burton to read stories live on Twitter,https://www.khou.com/article/news/health/coronavirus/reading-rainbow-host-levar-burton-to-read-stories-live-on-twitter/285-e7a662c8-1d41-4b9f-b07e-7af3d53ce453
"Coronavirus live updates: Wimbledon canceled; US death toll tops 4,000",https://www.khou.com/article/news/health/coronavirus/live-updates-blog-april-1-2020/285-f7009449-6e43-4a23-8a54-7597c8f7bd38
Wimbledon canceled for 1st time since WWII because of virus,https://www.khou.com/article/news/health/coronavirus/wimbledon-canceled-for-1st-time-since-wwii-because-of-virus/285-27aaba85-e9e6-444a-8238-896e010e6d96
PHOTOS: Nurses pray for the world on hospital’s helipad as COVID-19 pandemic continues,https://www.khou.com/article/news/health/coronavirus/photos-nurses-pray-for-the-world-on-hospitals-helipad/285-be71fb5d-06a7-4c7f-9bd0-c077abdc7e5a
'Go home! Watch TV!' | Larry David wants you to curb your enthusiasm for going outside amid the coronavirus pandemic,https://www.khou.com/article/news/health/coronavirus/larry-david-coronavirus-psa/285-e49bdf5f-369a-4f62-9042-86a9656128a8
"Cruise ships must stay at sea with sick onboard, Coast Guard says",https://www.khou.com/article/news/health/coronavirus/cruise-ships-ordered-to-stay-at-sea-with-sick-onboard/285-cc871a77-253f-4ccc-9a56-d80781618bd0
