Headline,link
Coronavirus updates: Matagorda County issues mandatory shelter-in-place order,https://www.khou.com/article/news/health/coronavirus/coronavirus-updates-houston-live-blog-april-2/285-48d423c4-a3dc-4c3a-a95f-beed9d151c89
Baylor College of Medicine enrolling participants in COVID-19 treatment trial,https://www.khou.com/article/news/health/coronavirus/baylor-college-of-medicine-enrolling-participants-in-covid-19-treatment-trial/285-dc8a13ee-d7aa-4257-8f54-606c12a091f8
"Houston-area high school seniors wonder if prom, graduation will still happen amid COVID-19 concerns",https://www.khou.com/article/news/health/coronavirus/houston-area-high-school-seniors-wonder-if-prom-graduation-will-still-happen-amid-covid-19-concerns/285-15607830-c81d-4b49-a5bd-a1b4d7eb7d97
"These states have issued stay-at-home orders, here's what that means",https://www.khou.com/article/news/health/coronavirus/what-does-shelter-in-place-mean-these-are-the-states-that-want-citizens-to-stay-home/285-9f19139a-2f1d-4c8b-9343-2c8fd42b2208
"Oil, gas industry hit hard by coronavirus pandemic",https://www.khou.com/article/news/health/coronavirus/oil-gas-industry-hit-hard-by-coronavirus-pandemic/285-b7bc3e2d-3dbb-49c9-ada3-67c6273d080b
States demand ventilators as feds ration limited supply,https://www.khou.com/article/news/health/coronavirus/states-demand-ventilators-as-feds-ration-limited-supply/285-6e4fd649-4f23-4f26-a6b9-06704cf92d12
Coronavirus: Tips on what to clean and disinfect in your home,https://www.khou.com/article/news/health/coronavirus/coronavirus-tips-on-what-to-clean-and-disinfect-in-your-home/285-9fc3b208-8579-4870-a833-128827b1d98b
