Headline,link
Coronavirus updates: NRG complex to be used as a 'last resort' medical shelter,https://www.khou.com/article/news/health/coronavirus/coronavirus-updates-houston-live-blog-april-6/285-3fca5511-726f-4157-b3cf-da3a3ee0cfca
Coronavirus updates: Over 80 people test positive at Texas City nursing home,https://www.khou.com/article/news/health/coronavirus/coronavirus-updates-houston-live-blog-april-3/285-6d1d2743-5612-4773-8627-3b9622f845d8
Here's how to make your own face mask if you don't have a sewing machine,https://www.khou.com/article/news/health/how-to-make-your-own-face-mask-if-you-dont-ave-a-sewing-machine/285-eaaa5823-eda2-460b-9aa0-218276b808d7
"Update: Fourth person dies from COVID-19 in Brazos County, 68 confirmed cases",https://www.khou.com/article/news/brazos-county-reports-cases-of-coronavirus/285-bb82428a-417e-4287-b7f8-ef6cf60ffa2b
Houston-area essential workers can apply for child care financial assistance,https://www.khou.com/article/news/health/coronavirus/find-houston-child-care-assistance-now-with-new-program/285-c6ae1a5f-d159-497f-ac14-f1a8fb1d4770
"Amid coronavirus pandemic, black mistrust of medicine looms",https://www.khou.com/article/news/health/coronavirus/coronavirus-pandemic-black-mistrust-of-medicine-looms/285-0535fce3-8741-4c58-ab71-61560a75b332
Houston Ballet cancels remainder of season due to coronavirus crisis,https://www.khou.com/article/news/health/coronavirus/houston-ballet-season-canceled-coronavirus/285-90168e19-e3c1-4fb5-aa9d-83fde474b071
