Headline,link
Judge Hidalgo amends Stay Home order to allow small religious gatherings that follow CDC guidelines,https://www.khou.com/article/news/health/coronavirus/judge-hidalgo-amends-stay-home-order-to-allow-small-religious-gatherings-that-follow-cdc-guidelines/285-995c77a8-f43b-471d-92e2-89558fd8f221
Coronavirus updates: Over 80 people test positive at Texas City nursing home,https://www.khou.com/article/news/health/coronavirus/coronavirus-updates-houston-live-blog-april-3/285-6d1d2743-5612-4773-8627-3b9622f845d8
Justin Verlander donating MLB paychecks to organizations helping those affected by COVID-19 crisis,https://www.khou.com/article/sports/mlb/astros/justin-verlander-donating-mlb-paychecks-to-organizations-helping-those-affected-by-covid-19-crisis/285-1d3b8197-7c20-4869-a8d2-40c876882265
A mounting casualty of coronavirus crisis: Health care jobs,https://www.khou.com/article/news/health/coronavirus/health-care-jobs-are-a-mounting-casualty-of-coronavirus-crisis/285-d656ba85-b425-49c3-85b5-b325340e3a64
"67 residents at San Antonio nursing home test positive, 1 death",https://www.khou.com/article/news/health/coronavirus/city-officials-provide-update-on-coronavirus-outbreak-at-nursing-home/285-d5a728d6-77ea-4ff5-b9c7-161c6bb3a2a8
"Coronavirus live updates: Delta pilots union says over 50 pilots have coronavirus; Trudeau, Trump to discuss export ban",https://www.khou.com/article/news/health/coronavirus/coronavirus-live-blog-updates-april-4-2020/285-8699f201-8668-4bb3-85fe-e53717ba6190
Asian Americans use social media to mobilize against attacks,https://www.khou.com/article/news/health/coronavirus/asian-americans-use-social-media-to-mobilize-against-attacks/285-0db35cf6-cb0c-4e03-97b6-5b53524a949b
