Headline,link
Watch live: White House Coronavirus Task Force to update the public,https://www.khou.com/article/news/health/coronavirus/coronavirus-live-blog-updates-april-6-2020/285-ceef9174-7d45-47c4-ac1b-7352661a8fd3
Coronavirus updates: Over 80 people test positive at Texas City nursing home,https://www.khou.com/article/news/health/coronavirus/coronavirus-updates-houston-live-blog-april-3/285-6d1d2743-5612-4773-8627-3b9622f845d8
"Direct deposits coming soon to Texans, Gov. Abbott says",https://www.khou.com/article/news/health/coronavirus/texas-coronavirus-covid-19-gov-abbott-ppe-direct-depost-cases-update/285-cde9c136-423e-40fe-a1b7-acdcb5e2cd2b
21 Harris County Sheriff's Office employees have tested positive for coronavirus,https://www.khou.com/article/news/health/coronavirus/15-harris-county-sheriffs-office-employees-have-tested-positive-for-coronavirus/285-fc1a021c-7af0-42bd-8a50-79646f7e55fc
Houston hospital seeking recovered coronavirus patients for plasma therapy trials,https://www.khou.com/article/news/health/coronavirus/houston-hospital-among-countrys-first-to-test-plasma-therapy-on-coronavirus-patients/285-f3829dac-8300-41ce-8d41-38cd9c97c481
British Prime Minister Boris Johnson moved to ICU after coronavirus symptoms 'worsened',https://www.khou.com/article/news/health/coronavirus/british-prime-minister-boris-johnson-moved-to-icu-after-coronavirus-symptoms-worsened/285-d3d372b9-9314-4a43-9afc-d18dc9be6828
"Virus is mostly mild and rarely fatal for US kids, data show",https://www.khou.com/article/news/health/coronavirus/virus-is-mostly-mild-and-rarely-fatal-for-us-kids-data-show/285-5d6c0317-633e-4091-85f3-ced056118489
